{
  "contract": "five-db-upload-manifest",
  "schema_version": "1",
  "manifest_id": "018f0f0f-0f10-7f0f-8f0f-0f0f0f0f0f0f",
  "account_id": "018f0f0f-0f00-7f0f-8f0f-0f0f0f0f0f0f",
  "profile_id": "018f0f0f-0f01-7f0f-8f0f-0f0f0f0f0f0f",
  "created_at": "2026-08-11T03:01:00Z",
  "game_mode": "SP7",
  "trust_domain": "official",
  "files": [
    {"file_name": "score.db", "sha256": "aaaaaaaaaaaaaaaaaaaaaaaaaaaaaaaaaaaaaaaaaaaaaaaaaaaaaaaaaaaaaaaa", "size_bytes": 100, "object_key": "profiles/018f0f0f-0f01-7f0f-8f0f-0f0f0f0f0f0f/uploads/score.db"},
    {"file_name": "scoredatalog.db", "sha256": "bbbbbbbbbbbbbbbbbbbbbbbbbbbbbbbbbbbbbbbbbbbbbbbbbbbbbbbbbbbbbbbb", "size_bytes": 200, "object_key": "profiles/018f0f0f-0f01-7f0f-8f0f-0f0f0f0f0f0f/uploads/scoredatalog.db"},
    {"file_name": "scorelog.db", "sha256": "cccccccccccccccccccccccccccccccccccccccccccccccccccccccccccccccc", "size_bytes": 300, "object_key": "profiles/018f0f0f-0f01-7f0f-8f0f-0f0f0f0f0f0f/uploads/scorelog.db"},
    {"file_name": "songdata.db", "sha256": "dddddddddddddddddddddddddddddddddddddddddddddddddddddddddddddddd", "size_bytes": 400, "object_key": "profiles/018f0f0f-0f01-7f0f-8f0f-0f0f0f0f0f0f/uploads/songdata.db"},
    {"file_name": "songinfo.db", "sha256": "eeeeeeeeeeeeeeeeeeeeeeeeeeeeeeeeeeeeeeeeeeeeeeeeeeeeeeeeeeeeeeee", "size_bytes": 500, "object_key": "profiles/018f0f0f-0f01-7f0f-8f0f-0f0f0f0f0f0f/uploads/songinfo.db"}
  ],
  "snapshot": {
    "static_snapshot": true,
    "wal_present": false,
    "shm_present": false,
    "source_generation": "018f0f0f-0f11-7f0f-8f0f-0f0f0f0f0f0f"
  },
  "privacy": {
    "contains_bms": false,
    "contains_replay": false,
    "aggregate_eligible": false
  }
}
